[
 {
  "agenda_item_number": "1",
  "archive_id": "bcc-2026-10-27-regular-agenda-packet",
  "archive_url": "https://archive.org/details/berkeley-public-records-bcc-2026-10-27-regular-agenda-packet",
  "city_source_url": "https://berkeleyca.gov/sites/default/files/city-council-meetings/2026-10-27%20Agenda%20Packet%20-%20Council%20-%20WEB.pdf",
  "last_checked_at": "2026-10-28",
  "meeting_date": "2026-10-27",
  "meeting_id": "city-council-2026-10-27",
  "meeting_type": "regular",
  "official_title": "Amendments to Berkeley Municipal Code (BMC) Section 23.304.100 (Site Features in Residential Districts) to require undergrounding of electrical transformers on private land",
  "record_id": "city-council-2026-10-27--item-1",
  "section": "Consent Calendar",
  "source_archive_commit": "7a22d845c6f0f8476f21d19f0d261500be4333c7",
  "source_locator": {
   "index_archive_id": "bcc-2026-10-27-regular-agenda-packet-items",
   "page_basis": "pages are the form-feed-delimited pages of the L1 text, counted from 1",
   "pages": [
    19,
    20
   ]
  },
  "source_retrieved_at": "2026-10-28",
  "source_sha256": "4bb13a52e74e750073ed5af5e40810542db2c539c81717b5f4f8001467c3e343",
  "status": "source_archived"
 },
 {
  "agenda_item_number": "2",
  "archive_id": "bcc-2026-10-27-regular-agenda-packet",
  "archive_url": "https://archive.org/details/berkeley-public-records-bcc-2026-10-27-regular-agenda-packet",
  "city_source_url": "https://berkeleyca.gov/sites/default/files/city-council-meetings/2026-10-27%20Agenda%20Packet%20-%20Council%20-%20WEB.pdf",
  "last_checked_at": "2026-10-28",
  "meeting_date": "2026-10-27",
  "meeting_id": "city-council-2026-10-27",
  "meeting_type": "regular",
  "official_title": "Waiver of Sanctuary City Ordinance for Westlaw Contract",
  "record_id": "city-council-2026-10-27--item-2",
  "section": "Consent Calendar",
  "source_archive_commit": "7a22d845c6f0f8476f21d19f0d261500be4333c7",
  "source_locator": {
   "index_archive_id": "bcc-2026-10-27-regular-agenda-packet-items",
   "page_basis": "pages are the form-feed-delimited pages of the L1 text, counted from 1",
   "pages": [
    21,
    24
   ]
  },
  "source_retrieved_at": "2026-10-28",
  "source_sha256": "4bb13a52e74e750073ed5af5e40810542db2c539c81717b5f4f8001467c3e343",
  "status": "source_archived"
 },
 {
  "agenda_item_number": "3",
  "archive_id": "bcc-2026-10-27-regular-agenda-packet",
  "archive_url": "https://archive.org/details/berkeley-public-records-bcc-2026-10-27-regular-agenda-packet",
  "city_source_url": "https://berkeleyca.gov/sites/default/files/city-council-meetings/2026-10-27%20Agenda%20Packet%20-%20Council%20-%20WEB.pdf",
  "last_checked_at": "2026-10-28",
  "meeting_date": "2026-10-27",
  "meeting_id": "city-council-2026-10-27",
  "meeting_type": "regular",
  "official_title": "2026 Annual Commission Attendance and Meeting Frequency Report",
  "record_id": "city-council-2026-10-27--item-3",
  "section": "Consent Calendar",
  "source_archive_commit": "7a22d845c6f0f8476f21d19f0d261500be4333c7",
  "source_locator": {
   "index_archive_id": "bcc-2026-10-27-regular-agenda-packet-items",
   "page_basis": "pages are the form-feed-delimited pages of the L1 text, counted from 1",
   "pages": [
    25,
    62
   ]
  },
  "source_retrieved_at": "2026-10-28",
  "source_sha256": "4bb13a52e74e750073ed5af5e40810542db2c539c81717b5f4f8001467c3e343",
  "status": "source_archived"
 },
 {
  "agenda_item_number": "4",
  "archive_id": "bcc-2026-10-27-regular-agenda-packet",
  "archive_url": "https://archive.org/details/berkeley-public-records-bcc-2026-10-27-regular-agenda-packet",
  "city_source_url": "https://berkeleyca.gov/sites/default/files/city-council-meetings/2026-10-27%20Agenda%20Packet%20-%20Council%20-%20WEB.pdf",
  "last_checked_at": "2026-10-28",
  "meeting_date": "2026-10-27",
  "meeting_id": "city-council-2026-10-27",
  "meeting_type": "regular",
  "official_title": "Contract: Adrien Segal Public Artwork Commission for Santa Fe Trackbed to Park Conversion",
  "record_id": "city-council-2026-10-27--item-4",
  "section": "Consent Calendar",
  "source_archive_commit": "7a22d845c6f0f8476f21d19f0d261500be4333c7",
  "source_locator": {
   "index_archive_id": "bcc-2026-10-27-regular-agenda-packet-items",
   "page_basis": "pages are the form-feed-delimited pages of the L1 text, counted from 1",
   "pages": [
    63,
    69
   ]
  },
  "source_retrieved_at": "2026-10-28",
  "source_sha256": "4bb13a52e74e750073ed5af5e40810542db2c539c81717b5f4f8001467c3e343",
  "status": "source_archived"
 },
 {
  "agenda_item_number": "5",
  "archive_id": "bcc-2026-10-27-regular-agenda-packet",
  "archive_url": "https://archive.org/details/berkeley-public-records-bcc-2026-10-27-regular-agenda-packet",
  "city_source_url": "https://berkeleyca.gov/sites/default/files/city-council-meetings/2026-10-27%20Agenda%20Packet%20-%20Council%20-%20WEB.pdf",
  "last_checked_at": "2026-10-28",
  "meeting_date": "2026-10-27",
  "meeting_id": "city-council-2026-10-27",
  "meeting_type": "regular",
  "official_title": "Contract No. 32500002 Amendment: Community Initiatives | Live Free USA for Gun Violence Intervention and Prevention Services",
  "record_id": "city-council-2026-10-27--item-5",
  "section": "Consent Calendar",
  "source_archive_commit": "7a22d845c6f0f8476f21d19f0d261500be4333c7",
  "source_locator": {
   "index_archive_id": "bcc-2026-10-27-regular-agenda-packet-items",
   "page_basis": "pages are the form-feed-delimited pages of the L1 text, counted from 1",
   "pages": [
    71,
    76
   ]
  },
  "source_retrieved_at": "2026-10-28",
  "source_sha256": "4bb13a52e74e750073ed5af5e40810542db2c539c81717b5f4f8001467c3e343",
  "status": "source_archived"
 },
 {
  "agenda_item_number": "6",
  "archive_id": "bcc-2026-10-27-regular-agenda-packet",
  "archive_url": "https://archive.org/details/berkeley-public-records-bcc-2026-10-27-regular-agenda-packet",
  "city_source_url": "https://berkeleyca.gov/sites/default/files/city-council-meetings/2026-10-27%20Agenda%20Packet%20-%20Council%20-%20WEB.pdf",
  "last_checked_at": "2026-10-28",
  "meeting_date": "2026-10-27",
  "meeting_id": "city-council-2026-10-27",
  "meeting_type": "regular",
  "official_title": "Formal Bid Solicitations and Request for Proposals Scheduled for Possible Issuance After Council Approval on October 27, 2026",
  "record_id": "city-council-2026-10-27--item-6",
  "section": "Consent Calendar",
  "source_archive_commit": "7a22d845c6f0f8476f21d19f0d261500be4333c7",
  "source_locator": {
   "index_archive_id": "bcc-2026-10-27-regular-agenda-packet-items",
   "page_basis": "pages are the form-feed-delimited pages of the L1 text, counted from 1",
   "pages": [
    77,
    79
   ]
  },
  "source_retrieved_at": "2026-10-28",
  "source_sha256": "4bb13a52e74e750073ed5af5e40810542db2c539c81717b5f4f8001467c3e343",
  "status": "source_archived"
 },
 {
  "agenda_item_number": "7",
  "archive_id": "bcc-2026-10-27-regular-agenda-packet",
  "archive_url": "https://archive.org/details/berkeley-public-records-bcc-2026-10-27-regular-agenda-packet",
  "city_source_url": "https://berkeleyca.gov/sites/default/files/city-council-meetings/2026-10-27%20Agenda%20Packet%20-%20Council%20-%20WEB.pdf",
  "last_checked_at": "2026-10-28",
  "meeting_date": "2026-10-27",
  "meeting_id": "city-council-2026-10-27",
  "meeting_type": "regular",
  "official_title": "Contract: Insight Public Sector, Inc. dba Aurelian for Non-Emergency Call- Taking Software",
  "record_id": "city-council-2026-10-27--item-7",
  "section": "Consent Calendar",
  "source_archive_commit": "7a22d845c6f0f8476f21d19f0d261500be4333c7",
  "source_locator": {
   "index_archive_id": "bcc-2026-10-27-regular-agenda-packet-items",
   "page_basis": "pages are the form-feed-delimited pages of the L1 text, counted from 1",
   "pages": [
    81,
    85
   ]
  },
  "source_retrieved_at": "2026-10-28",
  "source_sha256": "4bb13a52e74e750073ed5af5e40810542db2c539c81717b5f4f8001467c3e343",
  "status": "source_archived"
 },
 {
  "agenda_item_number": "8",
  "archive_id": "bcc-2026-10-27-regular-agenda-packet",
  "archive_url": "https://archive.org/details/berkeley-public-records-bcc-2026-10-27-regular-agenda-packet",
  "city_source_url": "https://berkeleyca.gov/sites/default/files/city-council-meetings/2026-10-27%20Agenda%20Packet%20-%20Council%20-%20WEB.pdf",
  "last_checked_at": "2026-10-28",
  "meeting_date": "2026-10-27",
  "meeting_id": "city-council-2026-10-27",
  "meeting_type": "regular",
  "official_title": "Contract No. 104289-1 Amendment: Jackson & Coker for Locum Tenens Psychiatrists",
  "record_id": "city-council-2026-10-27--item-8",
  "section": "Consent Calendar",
  "source_archive_commit": "7a22d845c6f0f8476f21d19f0d261500be4333c7",
  "source_locator": {
   "index_archive_id": "bcc-2026-10-27-regular-agenda-packet-items",
   "page_basis": "pages are the form-feed-delimited pages of the L1 text, counted from 1",
   "pages": [
    87,
    90
   ]
  },
  "source_retrieved_at": "2026-10-28",
  "source_sha256": "4bb13a52e74e750073ed5af5e40810542db2c539c81717b5f4f8001467c3e343",
  "status": "source_archived"
 },
 {
  "agenda_item_number": "9",
  "archive_id": "bcc-2026-10-27-regular-agenda-packet",
  "archive_url": "https://archive.org/details/berkeley-public-records-bcc-2026-10-27-regular-agenda-packet",
  "city_source_url": "https://berkeleyca.gov/sites/default/files/city-council-meetings/2026-10-27%20Agenda%20Packet%20-%20Council%20-%20WEB.pdf",
  "last_checked_at": "2026-10-28",
  "meeting_date": "2026-10-27",
  "meeting_id": "city-council-2026-10-27",
  "meeting_type": "regular",
  "official_title": "Contracts for Recruitment Services ***Item Removed by City Manager***",
  "record_id": "city-council-2026-10-27--item-9",
  "section": "Consent Calendar",
  "source_archive_commit": "7a22d845c6f0f8476f21d19f0d261500be4333c7",
  "source_locator": {
   "index_archive_id": "bcc-2026-10-27-regular-agenda-packet-items",